{
  "parameters": {
    "api-version": "2023-07-01",
    "imageName": "myImage",
    "parameters": {
      "location": "West US",
      "properties": {
        "storageProfile": {
          "osDisk": {
            "diskEncryptionSet": {
              "id": "/subscriptions/{subscription-id}/resourceGroups/myResourceGroup/providers/Microsoft.Compute/diskEncryptionSets/{existing-diskEncryptionSet-name}"
            },
            "managedDisk": {
              "id": "subscriptions/{subscription-id}/resourceGroups/myResourceGroup/providers/Microsoft.Compute/disks/myManagedDisk"
            },
            "osState": "Generalized",
            "osType": "Linux"
          }
        }
      }
    },
    "resourceGroupName": "myResourceGroup",
    "subscriptionId": "{subscription-id}"
  },
  "responses": {
    "200": {
      "body": {
        "name": "myImage",
        "type": "Microsoft.Compute/images",
        "id": "/subscriptions/{subscription-id}/resourceGroups/disk/providers/Microsoft.Compute/images/myImage",
        "location": "westus",
        "properties": {
          "provisioningState": "Creating",
          "storageProfile": {
            "dataDisks": [],
            "osDisk": {
              "caching": "ReadWrite",
              "diskEncryptionSet": {
                "id": "/subscriptions/{subscription-id}/resourceGroups/myResourceGroup/providers/Microsoft.Compute/diskEncryptionSets/{existing-diskEncryptionSet-name}"
              },
              "managedDisk": {
                "id": "subscriptions/{subscription-id}/resourceGroups/myResourceGroup/providers/Microsoft.Compute/disks/myManagedDisk"
              },
              "osState": "Generalized",
              "osType": "Linux"
            }
          }
        }
      }
    },
    "201": {
      "body": {
        "name": "myImage",
        "type": "Microsoft.Compute/images",
        "id": "/subscriptions/{subscription-id}/resourceGroups/disk/providers/Microsoft.Compute/images/myImage",
        "location": "westus",
        "properties": {
          "provisioningState": "Creating",
          "storageProfile": {
            "dataDisks": [],
            "osDisk": {
              "caching": "ReadWrite",
              "diskEncryptionSet": {
                "id": "/subscriptions/{subscription-id}/resourceGroups/myResourceGroup/providers/Microsoft.Compute/diskEncryptionSets/{existing-diskEncryptionSet-name}"
              },
              "managedDisk": {
                "id": "subscriptions/{subscription-id}/resourceGroups/myResourceGroup/providers/Microsoft.Compute/disks/myManagedDisk"
              },
              "osState": "Generalized",
              "osType": "Linux"
            }
          }
        }
      }
    }
  },
  "operationId": "Images_CreateOrUpdate",
  "title": "Create a virtual machine image from a snapshot with DiskEncryptionSet resource."
}