{
  "parameters": {
    "api-version": "2023-07-01",
    "parameters": {
      "location": "westus",
      "properties": {
        "overprovision": true,
        "upgradePolicy": {
          "mode": "Manual"
        },
        "virtualMachineProfile": {
          "networkProfile": {
            "networkInterfaceConfigurations": [
              {
                "name": "{vmss-name}",
                "properties": {
                  "enableIPForwarding": true,
                  "ipConfigurations": [
                    {
                      "name": "{vmss-name}",
                      "properties": {
                        "subnet": {
                          "id": "/subscriptions/{subscription-id}/resourceGroups/myResourceGroup/providers/Microsoft.Network/virtualNetworks/{existing-virtual-network-name}/subnets/{existing-subnet-name}"
                        }
                      }
                    }
                  ],
                  "primary": true
                }
              }
            ]
          },
          "osProfile": {
            "adminPassword": "{your-password}",
            "adminUsername": "{your-username}",
            "computerNamePrefix": "{vmss-name}"
          },
          "scheduledEventsProfile": {
            "terminateNotificationProfile": {
              "enable": true,
              "notBeforeTimeout": "PT5M"
            }
          },
          "storageProfile": {
            "imageReference": {
              "offer": "WindowsServer",
              "publisher": "MicrosoftWindowsServer",
              "sku": "2016-Datacenter",
              "version": "latest"
            },
            "osDisk": {
              "caching": "ReadWrite",
              "createOption": "FromImage",
              "managedDisk": {
                "storageAccountType": "Standard_LRS"
              }
            }
          }
        }
      },
      "sku": {
        "name": "Standard_D1_v2",
        "capacity": 3,
        "tier": "Standard"
      }
    },
    "resourceGroupName": "myResourceGroup",
    "subscriptionId": "{subscription-id}",
    "vmScaleSetName": "{vmss-name}"
  },
  "responses": {
    "200": {
      "body": {
        "name": "{vmss-name}",
        "type": "Microsoft.Compute/virtualMachineScaleSets",
        "id": "/subscriptions/{subscription-id}/resourceGroups/myResourceGroup/providers/Microsoft.Compute/virtualMachineScaleSets/{vmss-name}",
        "location": "westus",
        "properties": {
          "overprovision": true,
          "provisioningState": "Creating",
          "singlePlacementGroup": true,
          "uniqueId": "d053ec5a-8da6-495f-ab13-38216503c6d7",
          "upgradePolicy": {
            "mode": "Manual"
          },
          "virtualMachineProfile": {
            "networkProfile": {
              "networkInterfaceConfigurations": [
                {
                  "name": "{vmss-name}",
                  "properties": {
                    "dnsSettings": {
                      "dnsServers": []
                    },
                    "enableAcceleratedNetworking": false,
                    "enableIPForwarding": true,
                    "ipConfigurations": [
                      {
                        "name": "{vmss-name}",
                        "properties": {
                          "privateIPAddressVersion": "IPv4",
                          "subnet": {
                            "id": "/subscriptions/{subscription-id}/resourceGroups/myResourceGroup/providers/Microsoft.Network/virtualNetworks/nsgExistingVnet/subnets/nsgExistingSubnet"
                          }
                        }
                      }
                    ],
                    "primary": true
                  }
                }
              ]
            },
            "osProfile": {
              "adminUsername": "{your-username}",
              "computerNamePrefix": "{vmss-name}",
              "secrets": [],
              "windowsConfiguration": {
                "enableAutomaticUpdates": true,
                "provisionVMAgent": true
              }
            },
            "scheduledEventsProfile": {
              "terminateNotificationProfile": {
                "enable": true,
                "notBeforeTimeout": "PT5M"
              }
            },
            "storageProfile": {
              "imageReference": {
                "offer": "WindowsServer",
                "publisher": "MicrosoftWindowsServer",
                "sku": "2016-Datacenter",
                "version": "latest"
              },
              "osDisk": {
                "caching": "ReadWrite",
                "createOption": "FromImage",
                "managedDisk": {
                  "storageAccountType": "Standard_LRS"
                }
              }
            }
          }
        },
        "sku": {
          "name": "Standard_D1_v2",
          "capacity": 3,
          "tier": "Standard"
        }
      }
    },
    "201": {
      "body": {
        "name": "{vmss-name}",
        "type": "Microsoft.Compute/virtualMachineScaleSets",
        "id": "/subscriptions/{subscription-id}/resourceGroups/myResourceGroup/providers/Microsoft.Compute/virtualMachineScaleSets/{vmss-name}",
        "location": "westus",
        "properties": {
          "overprovision": true,
          "provisioningState": "Creating",
          "singlePlacementGroup": true,
          "uniqueId": "d053ec5a-8da6-495f-ab13-38216503c6d7",
          "upgradePolicy": {
            "mode": "Manual"
          },
          "virtualMachineProfile": {
            "networkProfile": {
              "networkInterfaceConfigurations": [
                {
                  "name": "{vmss-name}",
                  "properties": {
                    "dnsSettings": {
                      "dnsServers": []
                    },
                    "enableAcceleratedNetworking": false,
                    "enableIPForwarding": true,
                    "ipConfigurations": [
                      {
                        "name": "{vmss-name}",
                        "properties": {
                          "privateIPAddressVersion": "IPv4",
                          "subnet": {
                            "id": "/subscriptions/{subscription-id}/resourceGroups/myResourceGroup/providers/Microsoft.Network/virtualNetworks/nsgExistingVnet/subnets/nsgExistingSubnet"
                          }
                        }
                      }
                    ],
                    "primary": true
                  }
                }
              ]
            },
            "osProfile": {
              "adminUsername": "{your-username}",
              "computerNamePrefix": "{vmss-name}",
              "secrets": [],
              "windowsConfiguration": {
                "enableAutomaticUpdates": true,
                "provisionVMAgent": true
              }
            },
            "scheduledEventsProfile": {
              "terminateNotificationProfile": {
                "enable": true,
                "notBeforeTimeout": "PT5M"
              }
            },
            "storageProfile": {
              "imageReference": {
                "offer": "WindowsServer",
                "publisher": "MicrosoftWindowsServer",
                "sku": "2016-Datacenter",
                "version": "latest"
              },
              "osDisk": {
                "caching": "ReadWrite",
                "createOption": "FromImage",
                "managedDisk": {
                  "storageAccountType": "Standard_LRS"
                }
              }
            }
          }
        },
        "sku": {
          "name": "Standard_D1_v2",
          "capacity": 3,
          "tier": "Standard"
        }
      }
    }
  },
  "operationId": "VirtualMachineScaleSets_CreateOrUpdate",
  "title": "Create a scale set with terminate scheduled events enabled."
}