{
  "parameters": {
    "api-version": "7.4-preview.1",
    "key-name": "testkey",
    "key-version": "9885aa558e8d448789683188f8c194b0",
    "parameters": {
      "alg": "RS512",
      "digest": "aKFG8NXcfTzqyR44rW42484K_zZI_T7zZuebvWuNgAoEI1gXYmxrshp42CunSmmu4oqo4-IrCikPkNIBkHXnAW2cv03Ad0UpwXhVfepK8zzDBaJPMKVGS-ZRz8CshEyGDKaLlb3J3zEkXpM3RrSEr0mdV6hndHD_mznLB5RmFui5DsKAhez4vUqajgtkgcPfCekMqeSwp6r9ItVL-gEoAohx8XMDsPedqu-7BuZcBcdayaPuBRL4wWoTDULA11P-UN_sJ5qMj3BbiRYhIlBWGR04wIGfZ3pkJjHJUpOvgH2QajdYPzUBauOCewMYbq9XkLRSzI_A7HkkDVycugSeAA",
      "value": "RUE3Nzg4NTQ4QjQ5RjFFN0U2NzAyQzhDNEMwMkJDOTA1MTYyOTUzNjI5NDhBNzZDQTlFOTM1NDA2M0ZGMjk2Mg"
    },
    "vaultBaseUrl": "https://myvault.vault.azure.net/"
  },
  "responses": {
    "200": {
      "body": {
        "value": true
      }
    }
  },
  "operationId": "verify",
  "title": "Verify"
}