{
  "operationId": "TrafficControllerInterface_CreateOrUpdate",
  "parameters": {
    "api-version": "2023-11-01",
    "resource": {
      "location": "NorthCentralUS",
      "tags": {
        "key1": "value1"
      }
    },
    "resourceGroupName": "rg1",
    "subscriptionId": "subid",
    "trafficControllerName": "tc1"
  },
  "title": "Put Traffic Controller",
  "responses": {
    "200": {
      "body": {
        "name": "tc1",
        "type": "Microsoft.ServiceNetworking/trafficControllers",
        "id": "/subscriptions/subid/resourceGroups/rg1/providers/Microsoft.ServiceNetworking/trafficControllers/tc1",
        "location": "NorthCentralUS",
        "properties": {
          "associations": [
            {
              "id": "/subscriptions/subid/resourceGroups/rg1/providers/Microsoft.ServiceNetworking/trafficControllers/tc1/association/as1"
            }
          ],
          "configurationEndpoints": [
            "abc.trafficcontroller.azure.net"
          ],
          "frontends": [
            {
              "id": "/subscriptions/subid/resourceGroups/rg1/providers/Microsoft.ServiceNetworking/trafficControllers/tc1/frontends/fe1"
            }
          ],
          "provisioningState": "Succeeded"
        },
        "tags": {
          "key1": "value1"
        }
      }
    },
    "201": {
      "body": {
        "name": "tc1",
        "type": "Microsoft.ServiceNetworking/trafficControllers",
        "id": "/subscriptions/subid/resourceGroups/rg1/providers/Microsoft.ServiceNetworking/trafficControllers/tc1",
        "location": "NorthCentralUS",
        "properties": {
          "associations": [
            {
              "id": "/subscriptions/subid/resourceGroups/rg1/providers/Microsoft.ServiceNetworking/trafficControllers/tc1/association/as1"
            }
          ],
          "configurationEndpoints": [
            "abc.trafficcontroller.azure.net"
          ],
          "frontends": [
            {
              "id": "/subscriptions/subid/resourceGroups/rg1/providers/Microsoft.ServiceNetworking/trafficControllers/tc1/frontends/fe1"
            }
          ],
          "provisioningState": "Succeeded"
        },
        "tags": {
          "key1": "value1"
        }
      }
    }
  }
}