{
  "parameters": {
    "api-version": "2018-05-01",
    "recordType": "CNAME",
    "resourceGroupName": "rg1",
    "subscriptionId": "subid",
    "zoneName": "zone1"
  },
  "responses": {
    "200": {
      "body": {
        "nextLink": "https://servicehost/subscriptions/subid/resourceGroups/rg1/providers/Microsoft.Network/dnsZones/zone1/CNAME?api-version=2018-05-01&$skipToken=skipToken",
        "value": [
          {
            "name": "record1",
            "type": "Microsoft.Network/dnsZones/CNAME",
            "etag": "00000000-0000-0000-0000-000000000000",
            "id": "/subscriptions/subid/resourceGroups/rg1/providers/Microsoft.Network/dnsZones/zone1/CNAME/record1",
            "properties": {
              "CNAMERecord": {
                "cname": "contoso.com"
              },
              "TTL": 3600,
              "fqdn": "record1.zone1",
              "metadata": {
                "key1": "value1"
              }
            }
          }
        ]
      }
    }
  },
  "operationId": "RecordSets_ListByType",
  "title": "List CNAME recordsets"
}