{
  "parameters": {
    "api-version": "2022-03-03",
    "gallery": {
      "location": "West US",
      "properties": {
        "description": "This is the gallery description.",
        "softDeletePolicy": {
          "isSoftDeleteEnabled": true
        }
      }
    },
    "galleryName": "myGalleryName",
    "resourceGroupName": "myResourceGroup",
    "subscriptionId": "{subscription-id}"
  },
  "responses": {
    "200": {
      "body": {
        "name": "myGalleryName",
        "location": "West US",
        "properties": {
          "description": "This is the gallery description.",
          "identifier": {
            "uniqueName": "{subscription-id}-MYGALLERYNAME"
          },
          "provisioningState": "Updating",
          "softDeletePolicy": {
            "isSoftDeleteEnabled": true
          }
        }
      }
    },
    "201": {
      "body": {
        "name": "myGalleryName",
        "location": "West US",
        "properties": {
          "description": "This is the gallery description.",
          "identifier": {
            "uniqueName": "{subscription-id}-MYGALLERYNAME"
          },
          "provisioningState": "Creating",
          "softDeletePolicy": {
            "isSoftDeleteEnabled": true
          }
        }
      }
    },
    "202": {
      "body": {
        "name": "myGalleryName",
        "location": "West US",
        "properties": {
          "description": "This is the gallery description.",
          "identifier": {
            "uniqueName": "{subscription-id}-MYGALLERYNAME"
          },
          "provisioningState": "Updating",
          "softDeletePolicy": {
            "isSoftDeleteEnabled": true
          }
        }
      }
    }
  },
  "operationId": "Galleries_CreateOrUpdate",
  "title": "Create or update a simple gallery with soft deletion enabled."
}