{
  "parameters": {
    "api-version": "2023-07-01",
    "resourceGroupName": "rgcompute",
    "subscriptionId": "{subscription-id}",
    "vmInstanceIDs": {
      "instanceIds": [
        "aaaaaaaaaaaaaaaaa"
      ]
    },
    "vmScaleSetName": "aaaaaaaaaaaaaaaaaaaaaaaaaaaaa"
  },
  "responses": {
    "200": {},
    "202": {
      "headers": {
        "location": "https://foo.com/operationstatus"
      }
    }
  },
  "operationId": "VirtualMachineScaleSets_Redeploy",
  "title": "VirtualMachineScaleSet_Redeploy_MaximumSet_Gen"
}