{
  "parameters": {
    "api-version": "2023-07-01",
    "resourceGroupName": "rgcompute",
    "subscriptionId": "{subscription-id}",
    "vmExtensionName": "aa",
    "vmName": "aaaaaaaaaaaaaaaaaaaaaaaaa"
  },
  "responses": {
    "200": {},
    "202": {
      "headers": {
        "location": "https://foo.com/operationstatus"
      }
    },
    "204": {}
  },
  "operationId": "VirtualMachineExtensions_Delete",
  "title": "VirtualMachineExtension_Delete_MinimumSet_Gen"
}