{
  "parameters": {
    "api-version": "2022-03-03",
    "galleryImageName": "myGalleryImageName",
    "galleryUniqueName": "galleryUniqueName",
    "location": "myLocation",
    "subscriptionId": "{subscription-id}"
  },
  "responses": {
    "200": {
      "body": {
        "nextLink": "http://svchost:99/subscriptions/{subscription-Id}/providers/Microsoft.Compute/sharedGalleries/galleryUniqueName/images/myGalleryImageName/versions?$skiptoken={token}/Subscriptions/{subscription-Id}/galleries/galleryUniqueName/images/myGalleryImageName/versions/myGalleryImageVersionName",
        "value": [
          {
            "name": "myGalleryImageVersionName",
            "identifier": {
              "uniqueId": "/SharedGalleries/galleryUniqueName/Images/myGalleryImageName/Versions/myGalleryImageVersionName"
            },
            "location": "myLocation",
            "properties": {
              "endOfLifeDate": "2022-03-20T09:12:28Z",
              "excludeFromLatest": false,
              "publishedDate": "2018-03-20T09:12:28Z",
              "storageProfile": {
                "osDiskImage": {
                  "diskSizeGB": 29,
                  "hostCaching": "None"
                }
              }
            }
          }
        ]
      }
    }
  },
  "operationId": "SharedGalleryImageVersions_List",
  "title": "List shared gallery image versions."
}