{
  "parameters": {
    "api-version": "2023-07-01",
    "parameters": {
      "location": "westus",
      "properties": {
        "hardwareProfile": {
          "vmSize": "Standard_D2s_v3"
        },
        "networkProfile": {
          "networkInterfaces": [
            {
              "id": "/subscriptions/{subscription-id}/resourceGroups/myResourceGroup/providers/Microsoft.Network/networkInterfaces/{existing-nic-name}",
              "properties": {
                "primary": true
              }
            }
          ]
        },
        "osProfile": {
          "adminPassword": "{your-password}",
          "adminUsername": "{your-username}",
          "computerName": "myVM"
        },
        "securityProfile": {
          "securityType": "TrustedLaunch",
          "uefiSettings": {
            "secureBootEnabled": true,
            "vTpmEnabled": true
          }
        },
        "storageProfile": {
          "imageReference": {
            "offer": "windowsserver-gen2preview-preview",
            "publisher": "MicrosoftWindowsServer",
            "sku": "windows10-tvm",
            "version": "18363.592.2001092016"
          },
          "osDisk": {
            "name": "myVMosdisk",
            "caching": "ReadOnly",
            "createOption": "FromImage",
            "managedDisk": {
              "storageAccountType": "StandardSSD_LRS"
            }
          }
        }
      }
    },
    "resourceGroupName": "myResourceGroup",
    "subscriptionId": "{subscription-id}",
    "vmName": "myVM"
  },
  "responses": {
    "200": {
      "body": {
        "name": "myVM",
        "type": "Microsoft.Compute/virtualMachines",
        "id": "/subscriptions/{subscription-id}/resourceGroups/myResourceGroup/providers/Microsoft.Compute/virtualMachines/myVM",
        "location": "westus",
        "properties": {
          "hardwareProfile": {
            "vmSize": "Standard_D2s_v3"
          },
          "networkProfile": {
            "networkInterfaces": [
              {
                "id": "/subscriptions/{subscription-id}/resourceGroups/myResourceGroup/providers/Microsoft.Network/networkInterfaces/nsgExistingNic",
                "properties": {
                  "primary": true
                }
              }
            ]
          },
          "osProfile": {
            "adminUsername": "{your-username}",
            "computerName": "myVM",
            "secrets": [],
            "windowsConfiguration": {
              "enableAutomaticUpdates": true,
              "provisionVMAgent": true
            }
          },
          "provisioningState": "Creating",
          "securityProfile": {
            "securityType": "TrustedLaunch",
            "uefiSettings": {
              "secureBootEnabled": true,
              "vTpmEnabled": true
            }
          },
          "storageProfile": {
            "dataDisks": [],
            "imageReference": {
              "offer": "windowsserver-gen2preview-preview",
              "publisher": "MicrosoftWindowsServer",
              "sku": "windows10-tvm",
              "version": "18363.592.2001092016"
            },
            "osDisk": {
              "name": "myVMosdisk",
              "caching": "ReadOnly",
              "createOption": "FromImage",
              "managedDisk": {
                "storageAccountType": "StandardSSD_LRS"
              },
              "osType": "Windows"
            }
          },
          "vmId": "5c0d55a7-c407-4ed6-bf7d-ddb810267c85"
        }
      }
    },
    "201": {
      "body": {
        "name": "myVM",
        "type": "Microsoft.Compute/virtualMachines",
        "id": "/subscriptions/{subscription-id}/resourceGroups/myResourceGroup/providers/Microsoft.Compute/virtualMachines/myVM",
        "location": "westus",
        "properties": {
          "hardwareProfile": {
            "vmSize": "Standard_D2s_v3"
          },
          "networkProfile": {
            "networkInterfaces": [
              {
                "id": "/subscriptions/{subscription-id}/resourceGroups/myResourceGroup/providers/Microsoft.Network/networkInterfaces/nsgExistingNic",
                "properties": {
                  "primary": true
                }
              }
            ]
          },
          "osProfile": {
            "adminUsername": "{your-username}",
            "computerName": "myVM",
            "secrets": [],
            "windowsConfiguration": {
              "enableAutomaticUpdates": true,
              "provisionVMAgent": true
            }
          },
          "provisioningState": "Creating",
          "securityProfile": {
            "securityType": "TrustedLaunch",
            "uefiSettings": {
              "secureBootEnabled": true,
              "vTpmEnabled": true
            }
          },
          "storageProfile": {
            "dataDisks": [],
            "imageReference": {
              "offer": "windowsserver-gen2preview-preview",
              "publisher": "MicrosoftWindowsServer",
              "sku": "windows10-tvm",
              "version": "18363.592.2001092016"
            },
            "osDisk": {
              "name": "myVMosdisk",
              "caching": "ReadOnly",
              "createOption": "FromImage",
              "managedDisk": {
                "storageAccountType": "StandardSSD_LRS"
              },
              "osType": "Windows"
            }
          },
          "vmId": "5c0d55a7-c407-4ed6-bf7d-ddb810267c85"
        }
      }
    }
  },
  "operationId": "VirtualMachines_CreateOrUpdate",
  "title": "Create a VM with Uefi Settings of secureBoot and vTPM."
}