{
  "parameters": {
    "api-version": "2023-07-01",
    "hibernate": true,
    "resourceGroupName": "rgcompute",
    "subscriptionId": "{subscription-id}",
    "vmName": "aaaaaaaaaa"
  },
  "responses": {
    "200": {},
    "202": {
      "headers": {
        "location": "https://foo.com/operationstatus"
      }
    }
  },
  "operationId": "VirtualMachines_Deallocate",
  "title": "VirtualMachine_Deallocate_MaximumSet_Gen"
}